{
  "schema_version": "1.0",
  "signal_id": "ars-trivy-20260706-0001",
  "observed_at": "2026-07-06T12:05:00Z",
  "ingested_at": "2026-07-06T12:06:10Z",
  "source": {
    "name": "trivy",
    "type": "vulnerability",
    "version": "0.53.0",
    "run_id": "trivy-demo-app-20260706"
  },
  "application": {
    "id": "app-demo-payments",
    "name": "demo-payments",
    "environment": "lab",
    "owner": "platform-security",
    "tier": "tier-1",
    "cluster": "hc-security-lab-eks",
    "namespace": "payments",
    "service": "payments-api",
    "repository": "https://github.example.local/security-lab/demo-payments",
    "commit_sha": "a41d9f6f3ad22a5b71a21c1a2c1170f4e4b01aaa",
    "image": "registry.example.local/demo-payments@sha256:1111222233334444555566667777888899990000aaaabbbbccccddddeeeeffff"
  },
  "resource": {
    "kind": "container_image",
    "name": "registry.example.local/demo-payments:1.4.2",
    "namespace": "payments",
    "labels": {
      "app.kubernetes.io/name": "demo-payments",
      "app.kubernetes.io/component": "api"
    }
  },
  "finding": {
    "id": "CVE-2026-0001:openssl",
    "title": "Critical OpenSSL vulnerability in runtime image",
    "description": "Synthetic demo CVE used to exercise application risk scoring.",
    "category": "cve",
    "severity": "critical",
    "status": "open",
    "cve_ids": [
      "CVE-2026-0001"
    ],
    "package": "openssl",
    "installed_version": "3.0.10-r0",
    "fixed_version": "3.0.14-r0",
    "evidence_hash": "sha256:aaaaaaaaaaaaaaaaaaaaaaaaaaaaaaaaaaaaaaaaaaaaaaaaaaaaaaaaaaaaaaaa"
  },
  "risk": {
    "score": 92,
    "score_band": "critical",
    "formula_version": "ars-v1",
    "impact": 1,
    "likelihood": 0.85,
    "exposure": 0.9,
    "exploitability": 0.8,
    "confidence": 0.95,
    "business_criticality": 0.8,
    "data_sensitivity": 0.7,
    "environment_weight": 3,
    "compensating_control_modifier": 0,
    "application_risk_score_delta": 18,
    "recommended_priority": "p0",
    "reasons": [
      "critical vulnerability",
      "internet-facing service",
      "fresh scanner evidence"
    ]
  },
  "evidence": {
    "summary": "Trivy reported a critical synthetic CVE in the demo-payments runtime image.",
    "elastic_index": "risk-signals-application",
    "elastic_document_id": "ars-trivy-20260706-0001",
    "raw_ref": "s3://example-lab-evidence/trivy/demo-payments/2026-07-06/report.json"
  },
  "remediation": {
    "action": "Rebuild the image with the fixed OpenSSL package and redeploy after review.",
    "owner": "platform-security",
    "status": "not_started",
    "due_at": "2026-07-08T12:00:00Z",
    "human_review_required": true
  },
  "tags": [
    "phase-6",
    "concert-replacement",
    "vulnerability"
  ],
  "labels": {
    "lab": "hashicorp-security-automation",
    "scanner": "trivy"
  }
}
